StockCode,Description,ProductCategory
22914,BLUE COAT RACK PARIS FASHION,0
84997C,BLUE 3 PIECE POLKADOT CUTLERY SET,0
22176,BLUE OWL SOFT TOY,0
85014A,BLACK/BLUE POLKADOT UMBRELLA,0
22192,BLUE DINER WALL CLOCK,0
22963,JAM JAR WITH GREEN LID,0
84625C,BLUE NEW BAROQUE CANDLESTICK CANDLE,0
22805,BLUE DRAWER KNOB ACRYLIC EDWARDIAN,0
20728,LUNCH BAG CARS BLUE,0
21914,BLUE HARMONICA IN BOX ,0
21244,BLUE POLKADOT PLATE ,0
22587,FELTCRAFT HAIRBAND RED AND BLUE,0
21481,FAWN BLUE HOT WATER BOTTLE,0
20773,BLUE PAISLEY NOTEBOOK,0
22670,FRENCH WC SIGN BLUE METAL,0
22925,BLUE GIANT GARDEN THERMOMETER,0
21124,SET/10 BLUE POLKADOT PARTY CANDLES,0
20866,BLUE ROSE FABRIC MIRROR,0
21441,BLUE BIRDHOUSE DECORATION,0
22092,BLUE PAISLEY TISSUE BOX,0
47599B,BLUE PARTY BAGS ,0
15044B,BLUE PAPER PARASOL ,0
22453,MEASURING TAPE BABUSHKA BLUE,0
22688,DOORMAT PEACE ON EARTH BLUE,0
21983,PACK OF 12 BLUE PAISLEY TISSUES ,0
22665,RECIPE BOX BLUE SKETCHBOOK DESIGN,0
22680,FRENCH BLUE METAL DOOR SIGN 5,0
85071A,BLUE CHARLIE+LOLA PERSONAL DOORSIGN,0
85135B,BLUE DRAGONFLY HELICOPTER,0
21928,JUMBO BAG SCANDINAVIAN PAISLEY,0
22314,OFFICE MUG WARMER CHOC+BLUE,0
22345,PARTY PIZZA DISH BLUE POLKADOT,0
22675,FRENCH KITCHEN SIGN BLUE METAL,0
35095A,BLUE VICTORIAN FABRIC OVAL BOX,0
84031B,CHARLIE LOLA BLUE HOT WATER BOTTLE ,0
90003C,MIDNIGHT BLUE PAIR HEART HAIR SLIDE,0
20854,BLUE PATCH PURSE PINK HEART,0
17129F,BLUE GLASS GEMS IN BAG,0
20971,PINK BLUE FELT CRAFT TRINKET BOX,0
22482,BLUE TEA TOWEL CLASSIC DESIGN,0
21670,BLUE SPOT CERAMIC DRAWER KNOB,0
22678,FRENCH BLUE METAL DOOR SIGN 3,0
22686,FRENCH BLUE METAL DOOR SIGN No,0
84870B,BLUE GEISHA GIRL ,0
21850,BLUE  DIAMANTE PEN IN GIFT BOX,0
22260,FELT EGG COSY BLUE RABBIT ,0
20752,BLUE POLKADOT WASHING UP GLOVES,0
20761,BLUE PAISLEY SKETCHBOOK,0
20931,BLUE POT PLANT CANDLE ,0
22304,COFFEE MUG BLUE PAISLEY DESIGN,0
22308,TEA COSY BLUE STRIPE,0
22324,BLUE POLKADOT KIDS BAG,0
22586,FELTCRAFT HAIRBAND PINK AND BLUE,0
22673,FRENCH GARDEN SIGN BLUE METAL,0
35916B,BLUE FELT HANGING HEART W FLOWER,0
47590A,BLUE HAPPY BIRTHDAY BUNTING,0
71496A,A4 WALL TIDY BLUE OFFICE,0
85040B,SET/4 BLUE FLOWER CANDLES IN BOWL,0
90124B,BLUE MURANO TWIST NECKLACE,0
22447,PIN CUSHION BABUSHKA BLUE,0
22524,CHILDRENS GARDEN GLOVES BLUE,0
20755,BLUE PAISLEY POCKET BOOK,0
21669,BLUE STRIPE CERAMIC DRAWER KNOB,0
21673,WHITE SPOT BLUE CERAMIC DRAWER KNOB,0
22431,WATERING CAN BLUE ELEPHANT,0
22676,FRENCH BLUE METAL DOOR SIGN 1,0
22672,FRENCH BATHROOM SIGN BLUE METAL,0
20986,BLUE CALCULATOR RULER,0
20675,BLUE POLKADOT BOWL,0
22450,SILK PURSE BABUSHKA BLUE,0
22514,CHILDS GARDEN SPADE BLUE,0
85124B,BLUE JUICY FRUIT PHOTO FRAME,0
72801D,4 SKY BLUE DINNER CANDLES,0
21499,BLUE POLKADOT WRAP,0
21393,BLUE POLKADOT PUDDING BOWL,0
21268,VINTAGE BLUE TINSEL REEL,0
21399,BLUE POLKADOT COFFEE MUG,0
21788,KIDS RAIN MAC BLUE,0
21240,BLUE POLKADOT CUP,0
21927,BLUE/CREAM STRIPE CUSHION COVER ,0
20615,BLUE POLKADOT PASSPORT COVER,0
20767,BLUE PAISLEY JOURNAL ,0
22518,CHILDS GARDEN BRUSH BLUE,0
85014a,BLACK/BLUE POLKADOT UMBRELLA,0
84673B,BLUE FLY SWAT,0
84247N,PACK/12 BLUE FOLKART CARDS,0
37489B,BLUE/YELLOW FLOWER DESIGN BIG MUG,0
37489C,GREEN/BLUE FLOWER DESIGN BIG MUG,0
85129C,BEADED CRYSTAL HEART BLUE SMALL,0
84849A,HELLO SAILOR BLUE SOAP HOLDER,0
84997c,BLUE 3 PIECE POLKADOT CUTLERY SET,0
84507C,BLUE CIRCLES DESIGN MONKEY DOLL,0
90128B,BLUE LEAVES AND BEADS PHONE CHARM,0
90152B,BLUE/GREEN SHELL NECKLACE W PENDANT,0
20661,BLUE POLKADOT PURSE ,0
20652,BLUE POLKADOT LUGGAGE TAG ,0
84877D,BLUE ROUND COMPACT MIRROR,0
79337,BLUE FLOCK GLASS CANDLEHOLDER,0
22671,FRENCH LAUNDRY SIGN BLUE METAL,0
35810B,ENAMEL BLUE RIM COFFEE CONTAINER,0
35241,ENAMEL BLUE RIM BISCUIT BIN,0
72800D,4 BLUE DINNER CANDLES SILVER FLOCK,0
22021,BLUE FELT EASTER EGG BASKET,0
79149B,SILICON STAR BULB  BLUE,0
78034B,BLUE NETTING STORAGE HANGER,0
79151B,"SILICON CUBE 25W, BLUE",0
84508C,BLUE CIRCLES DESIGN TEDDY,0
84874B,BLUE TRAVEL FIRST AID KIT,0
22674,FRENCH TOILET SIGN BLUE METAL,0
22684,FRENCH BLUE METAL DOOR SIGN 9,0
84563B,BLUE & WHITE BREAKFAST TRAY,0
20671,BLUE TEATIME PRINT BOWL ,0
47369B,BLUE GREEN EMBROIDERY COSMETIC BAG,0
21401,BLUE PUDDING SPOON,0
84596L,BISCUITS SMALL BOWL LIGHT BLUE,0
84531B,BLUE KNITTED EGG COSY,0
22690,DOORMAT HOME SWEET HOME BLUE ,0
84881,BLUE WIRE SPIRAL CANDLE HOLDER,0
21397,BLUE POLKADOT EGG CUP ,0
22279,POCKET BAG BLUE PAISLEY RED SPOT,0
22677,FRENCH BLUE METAL DOOR SIGN 2,0
22682,FRENCH BLUE METAL DOOR SIGN 7,0
21403,BLUE EGG  SPOON,0
85131C,BEADED CRYSTAL HEART BLUE ON STICK,0
84968F,SET OF 16 VINTAGE SKY BLUE CUTLERY,0
37479B,CUBIC MUG FLOCK BLUE ON BROWN,0
22683,FRENCH BLUE METAL DOOR SIGN 8,0
22685,FRENCH BLUE METAL DOOR SIGN 0,0
16169N,WRAP BLUE RUSSIAN FOLKART,0
17007B,S/3 POT POURI CUSHIONS BLUE COLOURS,0
22681,FRENCH BLUE METAL DOOR SIGN 6,0
84916,HAND TOWEL PALE BLUE W FLOWERS,0
40005B,BLUE ORGANDY ROUND LAMPSHADE W BEA,0
18094C,WHITE AND BLUE CERAMIC OIL BURNER,0
84313B,BLUE TV TRAY TABLE ,0
84422,PINK/BLUE DISC/MIRROR STRING,0
90013A,MIDNIGHT BLUE VINTAGE EARRINGS,0
20857,BLUE ROSE PATCH PURSE PINK BUTTERFL,0
22679,FRENCH BLUE METAL DOOR SIGN 4,0
22520,CHILDS GARDEN TROWEL BLUE ,0
22516,CHILDS GARDEN RAKE BLUE,0
90000B,MIDNIGHT BLUE COPPER FLOWER NECKLAC,0
20794,BLUE  TILE HOOK,0
22051,BLUE SCANDINAVIAN PAISLEY WRAP,0
84613C,BLUE NEW BAROQUE FLOCK CANDLESTICK,0
84415B,BLUE FLOCK CUSHION COVER ,0
20695,FLORAL BLUE MONSTER,0
84876D,BLUE HEART COMPACT MIRROR,0
22201,FRYING PAN BLUE POLKADOT,0
37444B,BLUE BREAKFAST CUP AND SAUCER ,0
15058A,BLUE POLKADOT GARDEN PARASOL,0
35915B,BLUE KNITTED HEN ,0
21318,GLASS CHALICE BLUE SMALL ,0
20793,BLUE TILED TRAY,0
85136B,BLUE SHARK HELICOPTER,0
85183A,CHARLIE & LOLA WASTEPAPER BIN BLUE,0
71495A,CD WALL TIDY BLUE OFFICE,0
22656,VINTAGE BLUE KITCHEN CABINET,0
22522,CHILDS GARDEN FORK BLUE ,0
75011,BLUE DAISY MOBILE,0
22963,JAM JAR WITH BLUE LID,0
22204,MILK PAN BLUE POLKADOT,0
72801d,4 SKY BLUE DINNER CANDLES,0
84620,BLUE GINGHAM ROSE CUSHION COVER,0
90012A,MIDNIGHT BLUE DROP CRYSTAL NECKLACE,0
90108,BLUE BLOSSOM HAIR CLIP,0
85135B,Found,0
35819B,"ACRYLIC HANGING JEWEL,BLUE",0
84968f,SET OF 16 VINTAGE SKY BLUE CUTLERY,0
84931B,BLUE SCOTTIE DOG W FLOWER PATTERN,0
90011A,MIDNIGHT BLUE CRYSTAL DROP EARRINGS,0
46138B,BLUE CHENILLE SHAGGY CUSHION COVER ,0
47351B,BLUE  VOILE LAMPSHADE,0
44091A,BLUE CRUSOE CHECK LAMPSHADE,0
90092,BLUE CRYSTAL BOOT PHONE CHARM,0
84745B,BLUE HANGING GINGHAM EASTER HEN,0
21461,BLUE EASTER EGG HUNT START POST,0
84796B,BLUE SAVANNAH PICNIC HAMPER FOR 2,0
20795,LARGE BLUE PROVENCAL CERAMIC BALL,0
85130C,BEADED CRYSTAL HEART BLUE  LARGE,0
84919,BLUE CUSHION COVER WITH FLOWER,0
17136A,BLUE STONES ON WIRE FOR CANDLE,0
90152C,BLUE/NAT SHELL NECKLACE W PENDANT,0
37491D,PURPLE/BLUE CERAMIC CANDLE HOLDER,0
84997C,CHILDRENS CUTLERY POLKADOT BLUE,0
44092B,BLUE WHITE PLASTIC RINGS LAMPSHADE,0
21928,JUMBO BAG SCANDINAVIAN BLUE PAISLEY,0
84997c,CHILDRENS CUTLERY POLKADOT BLUE,0
90187A,BLUE DROP EARRINGS W BEAD CLUSTER,0
20796,SMALL BLUE PROVENCAL CERAMIC BALL,0
23051,RECYCLED ACAPULCO MAT BLUE,0
16248B,BLUE HOLE PUNCH,0
84086B,YELLOW/BLUE RETRO RADIO,0
21395,BLUE POLKADOT BEAKER ,0
47013A,WINE BOTTLE DRESSING LT.BLUE,0
47344B,BLUE FLOWER DES PURSE,0
47013C,WINE BOTTLE DRESSING DARK BLUE,0
84548,CROCHET BEAR RED/BLUE  KEYRING,0
35809B,ENAMEL BLUE RIM TEA CONTAINER,0
84576,BLUE CAT BISCUIT BARREL PINK HEART,0
84875D,BLUE SQUARE COMPACT MIRROR,0
62043B,BLUE CHECK BAG W HANDLE 34X20CM,0
20703,BLUE PADDED SOFT MOBILE,0
16202B,PASTEL BLUE PHOTO ALBUM ,0
90036C,"FLOWER GLASS GARLAND NECKL.36""BLUE",0
16244B,MAXWELL 2 TONE BLUE 60 PAGE PHOTO A,0
47341B,BLUE TABLE RUN FLOWER,0
62097B,BLUE STRIPES SHOULDER BAG,0
84859B,BLUE DISCO HANDBAG,0
16151A,FLOWERS HANDBAG blue and orange,0
84804B,BLUE DELPHINIUM ARTIFICIAL FLOWER,0
84596l,BISCUITS SMALL BOWL LIGHT BLUE,0
35916B,BLUE FELT HANGING HEART WITH FLOWER,0
23286,BLUE VINTAGE SPOT BEAKER,0
90001B,ANTIQUE MID BLUE FLOWER EARRINGS,0
23339,EGG FRYING PAN BLUE ,0
23028,DRAWER KNOB CRACKLE GLAZE BLUE,0
23028,DOORKNOB CRACKED GLAZE BLUE,0
23317,BLUE REFECTORY CLOCK ,0
84857B,BLUE MONTE CARLO HANDBAG,0
81952B,ROUND BLUE CLOCK WITH SUCKER,0
81950B,FLOWER BLUE CLOCK WITH SUCKER,0
81953B,ROUND BLUE CLOCK WITH SUCKER,0
35638B,PINK/BLUE STRING CURTAIN ,0
37491B,BLUE/YELLOW CERAMIC CANDLE HOLDER,0
37491C,GREEN/BLUE CERAMIC CANDLE HOLDER,0
84963B,BLUE PAINTED KASHMIRI CHAIR,0
35818B,"ACRYLIC JEWEL ICICLE, BLUE",0
84805B,BLUE CLIMBING HYDRANGA ART FLOWER,0
23446,BLUE BUNNY EASTER EGG BASKET,0
23477,WOODLAND LARGE BLUE FELT HEART,0
23474,WOODLAND SMALL BLUE FELT HEART,0
79157B,UBO-LIGHT TRIOBASE BLUE,0
84031b,CHARLIE LOLA BLUE HOT WATER BOTTLE ,0
23430,BLUE RETRO KITCHEN WALL CLOCK,0
22925,AMAZON,0
71053,WHITE METAL LANTERN,1
84406B,CREAM CUPID HEARTS COAT HANGER,1
84029G,KNITTED UNION FLAG HOT WATER BOTTLE,1
22633,HAND WARMER UNION JACK,1
22632,HAND WARMER RED POLKA DOT,1
84879,ASSORTED COLOUR BIRD ORNAMENT,1
22745,POPPY'S PLAYHOUSE BEDROOM ,1
22748,POPPY'S PLAYHOUSE KITCHEN,1
22749,FELTCRAFT PRINCESS CHARLOTTE DOLL,1
22310,IVORY KNITTED MUG COSY ,1
84969,BOX OF 6 ASSORTED COLOUR TEASPOONS,1
22623,BOX OF VINTAGE JIGSAW BLOCKS ,1
22622,BOX OF VINTAGE ALPHABET BLOCKS,1
21754,HOME BUILDING BLOCK WORD,1
21755,LOVE BUILDING BLOCK WORD,1
48187,DOORMAT NEW ENGLAND,1
22913,RED COAT RACK PARIS FASHION,1
22912,YELLOW COAT RACK PARIS FASHION,1
21756,BATH BUILDING BLOCK WORD,1
22727,ALARM CLOCK BAKELIKE RED ,1
22726,ALARM CLOCK BAKELIKE GREEN,1
21724,PANDA AND BUNNIES STICKER SHEET,1
21883,STARS GIFT TAPE ,1
10002,INFLATABLE POLITICAL GLOBE ,1
21791,VINTAGE HEADS AND TAILS CARD GAME ,1
22629,SPACEBOY LUNCH BOX ,1
22659,LUNCH BOX I LOVE LONDON,1
22631,CIRCUS PARADE LUNCH BOX ,1
22661,CHARLOTTE BAG DOLLY GIRL DESIGN,1
21731,RED TOADSTOOL LED NIGHT LIGHT,1
21913,VINTAGE SEASIDE JIGSAW PUZZLES,1
22540,MINI JIGSAW CIRCUS PARADE ,1
22544,MINI JIGSAW SPACEBOY,1
POST,POSTAGE,1
22086,PAPER CHAIN KIT 50'S CHRISTMAS ,1
20679,EDWARDIAN PARASOL RED,1
37370,RETRO COFFEE MUGS ASSORTED,1
21871,SAVE THE PLANET MUG,1
21071,VINTAGE BILLBOARD DRINK ME MUG,1
21068,VINTAGE BILLBOARD LOVE/HATE MUG,1
82483,WOOD 2 DRAWER CABINET WHITE FINISH,1
82486,WOOD S/3 CABINET ANT WHITE FINISH,1
82482,WOODEN PICTURE FRAME WHITE FINISH,1
82494L,WOODEN FRAME ANTIQUE WHITE ,1
21258,VICTORIAN SEWING BOX LARGE,1
22114,HOT WATER BOTTLE TEA AND SYMPATHY,1
85099C,JUMBO  BAG BAROQUE BLACK WHITE,1
21033,JUMBO BAG CHARLIE AND LOLA TOYS,1
20723,STRAWBERRY CHARLOTTE BAG,1
20725,LUNCH BAG RED RETROSPOT,1
21559,STRAWBERRY LUNCH BOX WITH CUTLERY,1
21975,PACK OF 60 DINOSAUR CAKE CASES,1
84991,60 TEATIME FAIRY CAKE CASES,1
85183B,CHARLIE & LOLA WASTEPAPER BIN FLORA,1
85071B,RED CHARLIE+LOLA PERSONAL DOORSIGN,1
21931,JUMBO STORAGE BAG SUKI,1
22411,JUMBO SHOPPER VINTAGE RED PAISLEY,1
82567,"AIRLINE LOUNGE,METAL SIGN",1
21672,WHITE SPOT RED CERAMIC DRAWER KNOB,1
22774,RED DRAWER KNOB ACRYLIC EDWARDIAN,1
22771,CLEAR DRAWER KNOB ACRYLIC EDWARDIAN,1
71270,PHOTO CLIP LINE,1
22262,FELT EGG COSY CHICKEN,1
21934,SKULL SHOULDER BAG,1
21169,YOU'RE CONFUSING ME METAL SIGN ,1
21166,COOK WITH WINE METAL SIGN ,1
21175,GIN + TONIC DIET METAL SIGN,1
37444A,YELLOW BREAKFAST CUP AND SAUCER,1
47580,TEA TIME DES TEA COSY,1
22261,FELT EGG COSY WHITE RABBIT ,1
22644,CERAMIC CHERRY CAKE MONEY BANK,1
15056BL,EDWARDIAN PARASOL BLACK,1
15056N,EDWARDIAN PARASOL NATURAL,1
22646,CERAMIC STRAWBERRY CAKE MONEY BANK,1
22438,BALLOON ART MAKE YOUR OWN FLOWERS,1
22778,GLASS CLOCHE SMALL,1
22719,GUMBALL MONOCHROME COAT RACK,1
21523,DOORMAT FANCY FONT HOME SWEET HOME,1
21912,VINTAGE SNAKES & LADDERS,1
21832,CHOCOLATE CALCULATOR,1
22798,ANTIQUE GLASS DRESSING TABLE POT,1
22926,IVORY GIANT GARDEN THERMOMETER,1
22839,3 TIER CAKE TIN GREEN AND CREAM,1
22838,3 TIER CAKE TIN RED AND CREAM,1
82484,WOOD BLACK BOARD ANT WHITE FINISH,1
21324,HANGING MEDINA LANTERN SMALL,1
22224,WHITE LOVEBIRD LANTERN,1
21340,CLASSIC METAL BIRDCAGE PLANT HOLDER,1
22427,ENAMEL FLOWER JUG CREAM,1
22428,ENAMEL FIRE BUCKET CREAM,1
22424,ENAMEL BREAD BIN CREAM,1
22663,JUMBO BAG DOLLY GIRL DESIGN,1
85049A,TRADITIONAL CHRISTMAS RIBBONS,1
22168,ORGANISER WOOD ANTIQUE WHITE ,1
22662,LUNCH BAG DOLLY GIRL DESIGN,1
79321,CHILLI LIGHTS,1
22779,WOODEN OWLS LIGHT GARLAND ,1
22466,FAIRY TALE COTTAGE NIGHTLIGHT,1
21363,HOME SMALL WOOD LETTERS,1
22915,ASSORTED BOTTLE TOP  MAGNETS ,1
22922,FRIDGE MAGNETS US DINER ASSORTED,1
22969,HOMEMADE JAM SCENTED CANDLES,1
22923,FRIDGE MAGNETS LES ENFANTS ASSORTED,1
21115,ROSE CARAVAN DOORSTOP,1
22242,5 HOOK HANGER MAGIC TOADSTOOL,1
21622,VINTAGE UNION JACK CUSHION COVER,1
22963,JAM JAR WITH GREEN LID,1
22968,ROSE COTTAGE KEEPSAKE BOX ,1
22910,PAPER CHAIN KIT VINTAGE CHRISTMAS,1
20668,DISCO BALL CHRISTMAS DECORATION,1
21786,POLKADOT RAIN HAT ,1
22654,DELUXE SEWING KIT ,1
84030E,ENGLISH ROSE HOT WATER BOTTLE,1
22174,PHOTO CUBE,1
22150,3 STRIPEY MICE FELTCRAFT,1
21891,TRADITIONAL WOODEN SKIPPING ROPE,1
21889,WOODEN BOX OF DOMINOES,1
22827,RUSTIC  SEVENTEEN DRAWER SIDEBOARD,1
22127,PARTY CONES CARNIVAL ASSORTED,1
22128,PARTY CONES CANDY ASSORTED,1
22502,PICNIC BASKET WICKER SMALL,1
22338,STAR DECORATION PAINTED ZINC ,1
21506,"FANCY FONT BIRTHDAY CARD, ",1
22866,HAND WARMER SCOTTY DOG DESIGN,1
22865,HAND WARMER OWL DESIGN,1
22632,HAND WARMER RED RETROSPOT,1
22349,DOG BOWL CHASING BALL DESIGN,1
85152,HAND OVER THE CHOCOLATE   SIGN ,1
22652,TRAVEL SEWING KIT,1
21484,CHICK GREY HOT WATER BOTTLE,1
22730,ALARM CLOCK BAKELIKE IVORY,1
22729,ALARM CLOCK BAKELIKE ORANGE,1
22867,HAND WARMER BIRD DESIGN,1
22803,IVORY EMBROIDERED QUILT ,1
48185,DOORMAT FAIRY CAKE,1
21232,STRAWBERRY CERAMIC TRINKET BOX,1
22835,HOT WATER BOTTLE I AM SO POORLY,1
22112,CHOCOLATE HOT WATER BOTTLE,1
21479,WHITE SKULL HOT WATER BOTTLE ,1
22111,SCOTTIE DOG HOT WATER BOTTLE,1
22110,BIRD HOUSE HOT WATER BOTTLE,1
22098,BOUDOIR SQUARE TISSUE BOX,1
22100,SKULLS SQUARE TISSUE BOX,1
22766,PHOTO FRAME CORNICE,1
22451,SILK PURSE BABUSHKA RED,1
22549,PICTURE DOMINOES,1
84744,S/6 SEW ON CROCHET FLOWERS,1
85049E,SCANDINAVIAN REDS RIBBONS,1
17091A,LAVENDER INCENSE IN TIN,1
22473,TV DINNER TRAY VINTAGE PAISLEY,1
22767,TRIPLE PHOTO FRAME CORNICE ,1
22768,FAMILY PHOTO FRAME CORNICE,1
21463,MIRRORED DISCO BALL ,1
21464,DISCO BALL ROTATOR BATTERY OPERATED,1
85150,LADIES & GENTLEMEN METAL SIGN,1
22117,METAL SIGN HER DINNER IS SERVED ,1
48129,DOORMAT TOPIARY,1
82580,BATHROOM METAL SIGN,1
82578,KITCHEN METAL SIGN,1
82581,TOILET METAL SIGN,1
22413,METAL SIGN TAKE IT OR LEAVE IT ,1
21907,I'M ON HOLIDAY METAL SIGN,1
22441,GROW YOUR OWN BASIL IN ENAMEL MUG,1
20966,SANDWICH BATH SPONGE,1
20963,APPLE BATH SPONGE,1
20961,STRAWBERRY BATH SPONGE ,1
22068,BLACK PIRATE TREASURE CHEST,1
21743,STAR PORTABLE TABLE LIGHT ,1
21744,SNOWFLAKE PORTABLE TABLE LIGHT ,1
21587,COSY HOUR GIANT TUBE MATCHES,1
20992,JAZZ HEARTS PURSE NOTEBOOK,1
20749,ASSORTED COLOUR MINI CASES,1
22382,LUNCH BAG SPACEBOY DESIGN ,1
20726,LUNCH BAG WOODLAND,1
22467,GUMBALL COAT RACK,1
21108,FAIRY CAKE FLANNEL ASSORTED COLOUR,1
22848,BREAD BIN DINER STYLE PINK,1
47570B,TEA TIME TABLE CLOTH,1
22837,HOT WATER BOTTLE BABUSHKA ,1
22773,GREEN DRAWER KNOB ACRYLIC EDWARDIAN,1
85049C,ROMANTIC PINKS RIBBONS ,1
85049D,BRIGHT BLUES RIBBONS ,1
85049G,CHOCOLATE BOX RIBBONS ,1
21061,PARTY INVITES FOOTBALL,1
21063,PARTY INVITES JAZZ HEARTS,1
21062,PARTY INVITES SPACEMAN,1
21213,PACK OF 72 SKULL CAKE CASES,1
22417,PACK OF 60 SPACEBOY CAKE CASES,1
84992,72 SWEETHEART FAIRY CAKE CASES,1
22383,LUNCH BAG SUKI  DESIGN ,1
20727,LUNCH BAG  BLACK SKULL.,1
22537,MAGIC DRAWING SLATE DINOSAUR,1
22533,MAGIC DRAWING SLATE BAKE A CAKE ,1
20982,12 PENCILS TALL TUBE SKULLS,1
21915,RED  HARMONICA IN BOX ,1
21544,SKULLS  WATER TRANSFER TATTOOS ,1
22813,PACK 3 BOXES BIRD PANNETONE ,1
22418,10 COLOUR SPACEBOY PEN,1
22465,HANGING METAL STAR LANTERN,1
48194,DOORMAT HEARTS,1
22488,NATURAL SLATE RECTANGLE CHALKBOARD,1
22219,LOVEBIRD HANGING DECORATION WHITE ,1
22610,PENS ASSORTED FUNNY FACE,1
22716,CARD CIRCUS PARADE,1
22706,WRAP COWBOYS  ,1
22371,AIRLINE BAG VINTAGE TOKYO 78,1
22553,PLASTERS IN TIN SKULLS,1
16237,SLEEPING CAT ERASERS,1
22714,CARD BIRTHDAY COWBOY,1
22812,PACK 3 BOXES CHRISTMAS PANNETONE,1
22736,RIBBON REEL MAKING SNOWMEN ,1
22620,4 TRADITIONAL SPINNING TOPS,1
21705,BAG 500g SWIRLY MARBLES,1
90199C,5 STRAND GLASS NECKLACE CRYSTAL,1
22975,SPACEBOY CHILDRENS EGG CUP,1
22972,CHILDREN'S SPACEBOY MUG,1
22568,FELTCRAFT CUSHION OWL,1
22664,TOY TIDY DOLLY GIRL DESIGN,1
21866,UNION JACK FLAG LUGGAGE TAG,1
90129F,RED GLASS TASSLE BAG CHARM,1
90210B,CLEAR ACRYLIC FACETED BANGLE,1
21955,DOORMAT UNION JACK GUNS AND ROSES,1
22109,FULL ENGLISH BREAKFAST PLATE,1
22531,MAGIC DRAWING SLATE CIRCUS PARADE  ,1
22183,CAKE STAND VICTORIAN FILIGREE MED,1
21678,PAISLEY PATTERN  STICKERS,1
21676,FLOWERS  STICKERS,1
16238,PARTY TIME PENCIL ERASERS,1
22075,6 RIBBONS ELEGANT CHRISTMAS ,1
21065,BOOM BOX SPEAKER GIRLS,1
22074,6 RIBBONS SHIMMERING PINKS ,1
20713,JUMBO BAG OWLS,1
21116,OWL DOORSTOP,1
21824,PAINTED METAL STAR WITH HOLLY BELLS,1
22153,ANGEL DECORATION STARS ON DRESS,1
85099F,JUMBO BAG STRAWBERRY,1
20717,STRAWBERRY SHOPPER BAG,1
22630,DOLLY GIRL LUNCH BOX,1
21245,GREEN POLKADOT PLATE ,1
22273,FELTCRAFT DOLL MOLLY,1
22940,FELTCRAFT CHRISTMAS FAIRY,1
21738,COSY SLIPPER SHOES SMALL  RED ,1
22077,6 RIBBONS RUSTIC CHARM,1
21448,12 DAISY PEGS IN WOOD BOX,1
22243,5 HOOK HANGER RED MAGIC TOADSTOOL,1
22141,CHRISTMAS CRAFT TREE TOP ANGEL,1
22144,CHRISTMAS CRAFT LITTLE FRIENDS,1
21739,COSY SLIPPER SHOES SMALL GREEN,1
22271,FELTCRAFT DOLL ROSIE,1
22274,FELTCRAFT DOLL EMILY,1
22751,FELTCRAFT PRINCESS OLIVIA DOLL,1
21034,REX CASH+CARRY JUMBO SHOPPER,1
22570,FELTCRAFT CUSHION RABBIT,1
22569,FELTCRAFT CUSHION BUTTERFLY,1
22902,TOTE BAG I LOVE LONDON,1
21710,FOLDING UMBRELLA PINKWHITE POLKADOT,1
21708,FOLDING UMBRELLA CREAM POLKADOT,1
21711,FOLDING UMBRELLA WHITE/RED POLKADOT,1
21706,FOLDING UMBRELLA RED/WHITE POLKADOT,1
22988,SOLDIERS EGG CUP ,1
22952,60 CAKE CASES VINTAGE CHRISTMAS,1
22739,RIBBON REEL CHRISTMAS SOCK BAUBLE,1
22738,RIBBON REEL SNOWY VILLAGE,1
35591T,TURQUOISE CHRISTMAS TREE ,1
22695,WICKER WREATH SMALL,1
22580,ADVENT CALENDAR GINGHAM SACK,1
22147,FELTCRAFT BUTTERFLY HEARTS,1
22130,PARTY CONE CHRISTMAS DECORATION ,1
22694,WICKER STAR ,1
21790,VINTAGE SNAP CARDS,1
22149,FELTCRAFT 6 FLOWER FRIENDS,1
22594,CHRISTMAS GINGHAM TREE,1
22593,CHRISTMAS GINGHAM STAR,1
22750,FELTCRAFT PRINCESS LOLA DOLL,1
22616,PACK OF 12 LONDON TISSUES ,1
22775,PURPLE DRAWERKNOB ACRYLIC EDWARDIAN,1
22899,CHILDREN'S APRON DOLLY GIRL ,1
22367,CHILDRENS APRON SPACEBOY DESIGN,1
22942,CHRISTMAS LIGHTS 10 SANTAS ,1
21976,PACK OF 60 MUSHROOM CAKE CASES,1
22951,60 CAKE CASES DOLLY GIRL DESIGN,1
22834,HAND WARMER BABUSHKA DESIGN,1
22472,TV DINNER TRAY DOLLY GIRL,1
22557,PLASTERS IN TIN VINTAGE PAISLEY ,1
22551,PLASTERS IN TIN SPACEBOY,1
22554,PLASTERS IN TIN WOODLAND ANIMALS,1
22534,MAGIC DRAWING SLATE SPACEBOY ,1
22529,MAGIC DRAWING SLATE GO TO THE FAIR ,1
22530,MAGIC DRAWING SLATE DOLLY GIRL ,1
84032B,CHARLIE + LOLA RED HOT WATER BOTTLE,1
85049H,URBAN BLACK RIBBONS ,1
21892,TRADITIONAL WOODEN CATCH CUP GAME ,1
21890,S/6 WOODEN SKITTLES IN COTTON BAG,1
21718,RED METAL BEACH SPADE ,1
21716,BOYS VINTAGE TIN SEASIDE BUCKET,1
21715,GIRLS VINTAGE TIN SEASIDE BUCKET,1
22358,KINGS CHOICE TEA CADDY ,1
22357,KINGS CHOICE BISCUIT TIN,1
22115,METAL SIGN EMPIRE TEA,1
22585,PACK OF 6 BIRDY GIFT TAGS,1
21556,CERAMIC STRAWBERRY MONEY BOX,1
22650,CERAMIC PIRATE CHEST MONEY BANK,1
17021,NAMASTE SWAGAT INCENSE,1
22059,CERAMIC STRAWBERRY DESIGN MUG,1
84678,CLASSICAL ROSE SMALL VASE,1
85172,HYACINTH BULB T-LIGHT CANDLES,1
22142,CHRISTMAS CRAFT WHITE FAIRY ,1
21591,COSY HOUR CIGAR BOX MATCHES ,1
22480,RED TEA TOWEL CLASSIC DESIGN,1
10133,COLOURING PENCILS BROWN TUBE,1
20774,GREEN FERN NOTEBOOK,1
20777,CHRYSANTHEMUM NOTEBOOK,1
16016,LARGE CHINESE STYLE SCISSOR,1
16014,SMALL CHINESE STYLE SCISSOR,1
21651,HANGING GLASS ETCHED TEALIGHT,1
21586,KINGS CHOICE GIANT TUBE MATCHES,1
22152,PLACE SETTING WHITE STAR,1
84849B,FAIRY SOAP SOAP HOLDER,1
22927,GREEN GIANT GARDEN THERMOMETER,1
22925,BLUE GIANT GARDEN THERMOMETER,1
21259,VICTORIAN SEWING BOX SMALL ,1
21257,VICTORIAN SEWING BOX MEDIUM,1
82552,WASHROOM METAL SIGN,1
90059B,DIAMANTE HAIR GRIP PACK/2 BLACK DIA,1
90185C,BLACK DIAMANTE EXPANDABLE RING,1
90059E,DIAMANTE HAIR GRIP PACK/2 RUBY,1
90059C,DIAMANTE HAIR GRIP PACK/2 MONTANA,1
22737,RIBBON REEL CHRISTMAS PRESENT ,1
21260,FIRST AID TIN,1
22744,MAKE YOUR OWN MONSOON CARD KIT,1
21985,PACK OF 12 HEARTS DESIGN TISSUES ,1
16258A,SWIRLY CIRCULAR RUBBERS IN BAG,1
22735,RIBBON REEL SOCKS AND MITTENS,1
22945,CHRISTMAS METAL TAGS ASSORTED ,1
10125,MINI FUNKY DESIGN TAPES,1
22573,STAR WOODEN CHRISTMAS DECORATION,1
85095,THREE CANVAS LUGGAGE TAGS,1
22731,3D CHRISTMAS STAMPS STICKERS ,1
22582,PACK OF 6 SWEETIE GIFT BOXES,1
22082,RIBBON REEL STRIPES DESIGN ,1
22742,MAKE YOUR OWN PLAYTIME CARD KIT,1
48173C,DOORMAT BLACK FLOCK ,1
22312,OFFICE MUG WARMER POLKADOT,1
21137,BLACK RECORD COVER FRAME,1
22041,"RECORD FRAME 7"" SINGLE SIZE ",1
20977,36 PENCILS TUBE WOODLAND,1
22571,ROCKING HORSE RED CHRISTMAS ,1
22423,REGENCY CAKESTAND 3 TIER,1
21621,VINTAGE UNION JACK BUNTING,1
47563A,RETRO LONGBOARD IRONING BOARD COVER,1
84558A,3D DOG PICTURE PLAYING CARDS,1
21577,SAVE THE PLANET COTTON TOTE BAG,1
22087,PAPER BUNTING WHITE LACE,1
22651,GENTLEMAN SHIRT REPAIR KIT ,1
22713,CARD I LOVE LONDON ,1
22372,AIRLINE BAG VINTAGE WORLD CHAMPION ,1
21894,POTTING SHED SEED ENVELOPES,1
70007,HI TEC ALPINE HAND WARMER,1
46000M,POLYESTER FILLER PAD 45x45cm,1
22712,CARD DOLLY GIRL ,1
22983,CARD BILLBOARD FONT,1
22024,RAINY LADIES BIRTHDAY CARD,1
21488,RED WHITE SCARF  HOT WATER BOTTLE,1
22784,LANTERN CREAM GAZEBO ,1
21794,CLASSIC FRENCH STYLE BASKET NATURAL,1
21292,SMALL STRIPES CHOCOLATE GIFT BAG ,1
22760,"TRAY, BREAKFAST IN BED",1
22107,PIZZA PLATE IN BOX,1
22099,CARAVAN SQUARE TISSUE BOX,1
22653,BUTTON BOX ,1
22906,12 MESSAGE CARDS WITH ENVELOPES,1
22754,SMALL RED BABUSHKA NOTEBOOK ,1
22919,HERB MARKER MINT,1
22917,HERB MARKER ROSEMARY,1
22920,HERB MARKER BASIL,1
22921,HERB MARKER CHIVES ,1
22918,HERB MARKER PARSLEY,1
22916,HERB MARKER THYME,1
22575,METAL MERRY CHRISTMAS WREATH,1
21804,WHITE CHRISTMAS GARLAND STARS TREES,1
22955,36 FOIL STAR CAKE CASES ,1
22583,PACK OF 6 HANDBAG GIFT BOXES,1
22241,GARLAND WOODEN HAPPY EASTER,1
22904,CALENDAR PAPER CUT DESIGN,1
22905,CALENDAR IN SEASON DESIGN,1
21358,TOAST ITS - HAPPY BIRTHDAY,1
21427,SKULLS STORAGE BOX SMALL,1
21930,JUMBO STORAGE BAG SKULLS,1
20772,GARDEN PATH JOURNAL,1
71406C,BLACK ORANGE SQUEEZER,1
20754,RETROSPOT RED WASHING UP GLOVES,1
21111,"SWISS ROLL TOWEL, CHOCOLATE  SPOTS",1
22501,PICNIC BASKET WICKER LARGE,1
22854,CREAM SWEETHEART EGG HOLDER,1
21664,RIDGED GLASS STORAGE JAR CREAM LID,1
22907,PACK OF 20 NAPKINS PANTRY DESIGN,1
22776,SWEETHEART CAKESTAND 3 TIER,1
21810,CHRISTMAS HANGING STAR WITH BELL,1
21197,MULTICOLOUR  CONFETTI IN TUBE,1
21098,CHRISTMAS TOILET ROLL,1
21192,WHITE BELL HONEYCOMB PAPER ,1
72800B, 4 PURPLE FLOCK DINNER CANDLES,1
47504H,ENGLISH ROSE SPIRIT LEVEL ,1
21742,LARGE ROUND WICKER PLATTER ,1
22481,BLACK TEA TOWEL CLASSIC DESIGN,1
22699,ROSES REGENCY TEACUP AND SAUCER ,1
21106,CREAM SLICE FLANNEL CHOCOLATE SPOT ,1
22697,GREEN REGENCY TEACUP AND SAUCER,1
22548,HEADS AND TAILS SPORTING FUN,1
17164B,ASS COL SMALL SAND GECKO P'WEIGHT,1
22429,ENAMEL MEASURING JUG CREAM,1
20974,12 PENCILS SMALL TUBE SKULL,1
20973,12 PENCIL SMALL TUBE WOODLAND,1
21135,VICTORIAN  METAL POSTCARD SPRING,1
22173,METAL 4 HOOK HANGER FRENCH CHATEAU,1
22626,BLACK KITCHEN SCALES,1
22625,RED KITCHEN SCALES,1
22624,IVORY KITCHEN SCALES,1
22244,3 HOOK HANGER MAGIC GARDEN,1
47421,ASSORTED COLOUR LIZARD SUCTION HOOK,1
20712,JUMBO BAG WOODLAND ANIMALS,1
22973,CHILDREN'S CIRCUS PARADE MUG,1
84569B,PACK 3 FIRE ENGINE/CAR PATCHES,1
22815,CARD PSYCHEDELIC APPLES,1
85114B,IVORY ENCHANTED FOREST PLACEMAT,1
22584,PACK OF 6 PANNETONE GIFT BOXES,1
22454,MEASURING TAPE BABUSHKA RED,1
85114C,RED ENCHANTED FOREST PLACEMAT,1
22974,CHILDRENS DOLLY GIRL MUG,1
21452,TOADSTOOL MONEY BOX,1
22743,MAKE YOUR OWN FLOWERPOWER CARD KIT,1
22911,PAPER CHAIN KIT LONDON,1
22445,PENCIL CASE LIFE IS BEAUTIFUL,1
22222,CAKE PLATE LOVEBIRD WHITE,1
22947,WOODEN ADVENT CALENDAR RED,1
22187,GREEN CHRISTMAS TREE CARD HOLDER,1
22164,STRING OF STARS CARD HOLDER,1
22627,MINT KITCHEN SCALES,1
22487,WHITE WOOD GARDEN PLANT LADDER,1
22360,GLASS JAR ENGLISH CONFECTIONERY,1
22364,GLASS JAR DIGESTIVE BISCUITS,1
21657,MILK BOTTLE WITH GLASS STOPPER ,1
22120,WELCOME  WOODEN BLOCK LETTERS,1
21625,VINTAGE UNION JACK APRON,1
22097,SWALLOW SQUARE TISSUE BOX,1
21179,NO JUNK MAIL METAL SIGN,1
22185,SLATE TILE NATURAL HANGING,1
21662,VINTAGE GLASS COFFEE CADDY,1
21654,RIDGED GLASS FINGER BOWL,1
21658,GLASS  BEURRE DISH,1
21519,GIN & TONIC DIET GREETING CARD ,1
22819,"BIRTHDAY CARD, RETRO SPOT",1
22704,WRAP RED APPLES ,1
22049,WRAP CHRISTMAS SCREEN PRINT,1
21497,FANCY FONTS BIRTHDAY WRAP,1
21333,CLASSIC WHITE FRAME,1
84692,BOX OF 24 COCKTAIL PARASOLS,1
22444,GROW YOUR OWN PLANT IN A CAN ,1
22556,PLASTERS IN TIN CIRCUS PARADE ,1
22555,PLASTERS IN TIN STRONGMAN,1
22547,MINI JIGSAW DINOSAUR ,1
22543,MINI JIGSAW BAKE A CAKE ,1
22539,MINI JIGSAW DOLLY GIRL,1
22489,PACK OF 12 TRADITIONAL CRAYONS,1
22814,CARD PARTY GAMES ,1
21520,BOOZE & WOMEN GREETING CARD ,1
21982,PACK OF 12 SUKI TISSUES ,1
21981,PACK OF 12 WOODLAND TISSUES ,1
21967,PACK OF 12 SKULL TISSUES,1
22615,PACK OF 12 CIRCUS PARADE TISSUES ,1
22614,PACK OF 12 SPACEBOY TISSUES,1
22095,LADS ONLY TISSUE BOX,1
22966,GINGERBREAD MAN COOKIE CUTTER,1
21874,GIN AND TONIC MUG,1
21873,IF YOU CAN'T STAND THE HEAT MUG,1
21870,I CAN ONLY PLEASE ONE PERSON MUG,1
22315,200 RED + WHITE BENDY STRAWS,1
22666,RECIPE BOX PANTRY YELLOW DESIGN,1
82600,NO SINGING METAL SIGN,1
22842,BISCUIT TIN VINTAGE RED,1
22494,EMERGENCY FIRST AID TIN ,1
22740,POLKADOT PEN,1
22825,DECORATIVE PLANT POT WITH FRIEZE,1
22118,JOY WOODEN BLOCK LETTERS,1
22121,NOEL WOODEN BLOCK LETTERS ,1
22119,PEACE WOODEN BLOCK LETTERS,1
22277,COSMETIC BAG VINTAGE ROSE PAISLEY,1
22800,ANTIQUE TALL SWIRLGLASS TRINKET POT,1
