StockCode,Description,ProductCategory
84898F,YELLOW FLOWERS FELT HANDBAG KIT,1
22415,WHITE TISSUE REAM,1
22256,FELT FARM ANIMAL CHICKEN,1
47310M,"SMALL POP BOX,FUNKY MONKEY",1
84508B,STRIPES DESIGN TEDDY,1
21555,CERAMIC STRAWBERRY TRINKET TRAY,1
22390,PAPERWEIGHT CHILDHOOD MEMORIES,1
84993B,75 BLACK PETIT FOUR CASES,1
85206A,CREAM FELT EASTER EGG BASKET,1
77101A,UNION FLAG WINDSOCK,1
84358,FLOOR LAMP SHADE WOOD BASE,1
21294,ETCHED GLASS COASTER,1
21468,BUTTERFLY CROCHET FOOD COVER,1
22123,PING MICROWAVE APRON,1
22939,APRON APPLE DELIGHT,1
22598,CHRISTMAS MUSICAL ZINC TREE,1
22532,MAGIC DRAWING SLATE LEAP FROG ,1
21682,LARGE MEDINA STAMPED METAL BOWL ,1
22894,TABLECLOTH RED APPLES DESIGN ,1
21209,MULTICOLOUR HONEYCOMB FAN,1
21635,MADRAS NOTEBOOK LARGE ,1
35653,VINTAGE BEAD NOTEBOOK,1
15039,SANDALWOOD FAN,1
90086,CRYSTAL FROG PHONE CHARM,1
62018,SOMBRERO ,1
16011,ANIMAL STICKERS,1
85179A,GREEN BITTY LIGHT CHAIN,1
21785,RAIN PONCHO ,1
20764,ABSTRACT CIRCLES SKETCHBOOK ,1
47579,TEA TIME BREAKFAST BASKET,1
21723,ALPHABET HEARTS STICKER SHEET,1
35953,FOLKART STAR CHRISTMAS DECORATIONS,1
84051,ASS COLOUR GLOWING TIARAS,1
21187,WHITE BELL HONEYCOMB PAPER GARLAND ,1
22034,ROBIN CHRISTMAS CARD,1
20980,36 PENCILS TUBE POSY,1
35958,FOLKART ZINC STAR CHRISTMAS DEC,1
22830,UTILTY CABINET WITH HOOKS,1
82011B,BATHROOM SCALES RUBBER DUCKS,1
21630,FLOOR CUSHION ELEPHANT CARNIVAL,1
21580,RABBIT  DESIGN  COTTON TOTE BAG,1
22231,JIGSAW TREE WITH BIRDHOUSE,1
22859,EASTER TIN BUNNY BOUQUET,1
22093,MOTORING TISSUE BOX,1
20748,KENSINGTON COFFEE SET,1
22129,PARTY CONES CANDY TREE DECORATION,1
85187,S/12 MINI RABBIT EASTER,1
21683,MEDIUM MEDINA STAMPED METAL BOWL ,1
22770,MIRROR CORNICE,1
79190A,RETRO PLASTIC 70'S TRAY,1
15034,PAPER POCKET TRAVELING FAN ,1
35924,HANGING FAIRY CAKE DECORATION,1
21904,HOUSE WRECKING METAL SIGN ,1
22843,BISCUIT TIN VINTAGE GREEN,1
22199,FRYING PAN RED RETROSPOT,1
84773,RED ROSE AND LACE C/COVER,1
21819,GLITTER CHRISTMAS STAR ,1
22817,CARD SUKI BIRTHDAY,1
16161U,WRAP SUKI AND FRIENDS,1
22252,BIRDCAGE DECORATION TEALIGHT HOLDER,1
51020A,SUMMER FUN DESIGN SHOWER CAP,1
51020B,STRIPY DESIGN SHOWER CAP,1
22475,SKULL DESIGN TV DINNER TRAY,1
21616,4 PEAR BOTANICAL DINNER CANDLES,1
20659,ECONOMY LUGGAGE TAG,1
22346,PARTY PIZZA DISH GREEN POLKADOT,1
85215,ASSORTED CHEESE FRIDGE MAGNETS,1
85062,PEARL CRYSTAL PUMPKIN T-LIGHT HLDR,1
22849,"BREAD BIN, DINER STYLE, MINT",1
22847,"BREAD BIN, DINER STYLE, IVORY",1
22984,CARD GINGHAM ROSE ,1
21202,DOLLY HONEYCOMB GARLAND,1
21910,WAY OUT METAL SIGN ,1
22461,SAVOY ART DECO CLOCK,1
22833,HALL CABINET WITH 3 DRAWERS,1
21613,S/12 VANILLA  BOTANICAL T-LIGHTS,1
84809A,WHITE CHRYSANTHEMUMS ART FLOWER,1
79190D,RETRO PLASTIC DAISY TRAY,1
22157,ANGEL DECORATION WITH LACE PADDED,1
84795B,SUNSET CHECK HAMMOCK,1
20771,CHRYSANTHEMUM  JOURNAL,1
37327,ASSTD MULTICOLOUR CIRCLES MUG,1
85027L,FRENCH CHATEAU LARGE PLATTER ,1
85017C,ENVELOPE 50 CURIOUS IMAGES,1
16010,FOLDING CAMPING SCISSOR W/KNIF & S,1
35001W,HAND OPEN SHAPE DECO.WHITE,1
21167,WHITE SAGE INCENSE,1
51008,AFGHAN SLIPPER SOCK PAIR,1
20802,SMALL GLASS SUNDAE DISH CLEAR,1
22052,VINTAGE CARAVAN GIFT WRAP,1
20781,GOLD EAR MUFF HEADPHONES,1
22389,PAPERWEIGHT SAVE THE PLANET,1
20716,PARTY FOOD SHOPPER BAG,1
20782,CAMOUFLAGE EAR MUFF HEADPHONES,1
21291,SMALL POLKADOT CHOCOLATE GIFT BAG ,1
21319,GLASS CHALICE GREEN  SMALL ,1
21359,RELAX LARGE WOOD LETTERS,1
21627,ELEPHANT CARNIVAL POUFFE,1
22106,MIRROR MOSAIC HURRICANE LAMP ,1
22108,PING! MICROWAVE PLATE,1
22282,12 EGG HOUSE PAINTED WOOD,1
22613,PACK OF 20 SPACEBOY NAPKINS,1
37447,CERAMIC CAKE DESIGN SPOTTED PLATE,1
46118,FUNKY MONKEY CUSHION COVER,1
46776C,WOVEN FROST CUSHION COVER,1
46776E,WOVEN CANDY CUSHION COVER ,1
62094B,TURQ ICE CREAM BUM BAG ,1
84228,HEN HOUSE W CHICK STANDING,1
84568,GIRLS ALPHABET IRON ON PATCHES ,1
84789,ENCHANTED BIRD PLANT CAGE,1
85093,CANDY SPOT EGG WARMER HARE,1
85096,HILDA CANDY SPOT RABBIT,1
85204,HANGING WOOD AND FELT FLOWER,1
90001D,ANTIQUE OLIVE GREEN FLOWER EARRINGS,1
90013C,GREEN VINTAGE EARRINGS ,1
90014B,GOLD M PEARL  ORBIT NECKLACE,1
90085,CRYSTAL STILETTO PHONE CHARM,1
90132,LIGHT TOPAZ TEAL/AQUA COL NECKLACE,1
90141B,IVORY PENDANT TRIPLE SHELL NECKLACE,1
90158,ST TROPEZ NECKLACE,1
90183A,AMBER DROP EARRINGS W LONG BEADS,1
90183B,AMETHYST DROP EARRINGS W LONG BEADS,1
90201B,BLACK ENAMEL FLOWER RING,1
22715,CARD WEDDING DAY,1
21534,DAIRY MAID LARGE MILK JUG,1
21618,4 WILDFLOWER BOTANICAL CANDLES,1
21812,GARLAND WITH HEARTS AND BELLS,1
21847,GREEN  DIAMANTE PEN IN GIFT BOX,1
21943,CAKES AND RABBITS DESIGN FLANNEL ,1
22322,BIRD DECORATION GREEN POLKADOT,1
22340,NOEL GARLAND PAINTED ZINC ,1
35833G,4 GOLD FLOCK CHRISTMAS BALLS,1
46776A,WOVEN BUBBLE GUM CUSHION COVER,1
90056,CHUNKY CRACKED GLAZE NECKLACE IVORY,1
90081C,LILY BROOCH OLIVE COLOUR,1
90101,WHITE FRANGIPANI NECKLACE,1
90130B,TURQ STONE/CRYSTAL EARRINGS,1
90130C,GREEN STONE/CRYSTAL EARRINGS,1
15044C,PURPLE PAPER PARASOL,1
20762,GREEN FERN SKETCHBOOK ,1
18007,ESSENTIAL BALM 3.5g TIN IN ENVELOPE,1
21720,CAKE SHOP  STICKER SHEET,1
22952,72 CAKE CASES VINTAGE CHRISTMAS,1
21289,LARGE STRIPES CHOCOLATE GIFT BAG,1
20903,VINTAGE KEEPSAKE BOX TRAVELOGUE,1
20897,VINTAGE NOTEBOOK PARIS DAYS,1
22691,DOORMAT WELCOME SUNRISE,1
21162,TOXIC AREA  DOOR HANGER ,1
84926D,LA PALMIERA TILE COASTER,1
22233,JIGSAW RABBIT AND BIRDHOUSE,1
22486,PLASMATRONIC LAMP,1
72801G,4 BURGUNDY WINE DINNER CANDLES,1
20769,DAISY JOURNAL ,1
47480,HANGING PHOTO CLIP ROPE LADDER,1
20731,POSY CANDY BAG,1
35597B,BLACKCHRISTMAS TREE 30CM,1
84596B,SMALL DOLLY MIX DESIGN ORANGE BOWL,1
21226,POCKET MIRROR WOODLAND,1
21647,ASSORTED TUTTI FRUTTI LARGE PURSE,1
84569A,PACK 3 IRON ON DOG PATCHES,1
20775,DAISY NOTEBOOK ,1
90179C,BLACK FINE BEAD NECKLACE W TASSEL,1
90060D,FIRE POLISHED GLASS NECKL BRONZE,1
79051A,SMOKEY GREY COLOUR D.O.F. GLASS,1
22700,BLACK AND WHITE DOG BOWL,1
10124A,SPOTS ON RED BOOKCOVER TAPE,1
46000P,POLYESTER FILLER PAD 65CMx65CM,1
22085,PAPER CHAIN KIT SKULLS ,1
46115B,GREEN POP ART MAO CUSHION COVER ,1
21336,GOLD WASHBAG,1
21680,WOODLAND  STICKERS,1
22535,MAGIC DRAWING SLATE BUNNIES ,1
16169K,WRAP FOLK ART,1
21001,ROSE DU SUD WASHBAG ,1
21028,NINJA RABBIT BLACK,1
21171,BATHROOM METAL SIGN ,1
21204,DAISIES  HONEYCOMB GARLAND ,1
21375,LARGE CAMPHOR WOOD FIELD MUSHROOM ,1
21595,Dad's Cab Electronic Meter,1
22101,MIRROR MOSAIC VOTIVE HOLDER,1
37462E,"PET MUG, GOLDFISH",1
47481,50CM METAL STRING WITH  7 CLIPS,1
84840,SWEETHEART CARRY-ALL BASKET,1
84917,WHITE HAND TOWEL WITH BUTTERFLY,1
85087,CANDY SPOT CUSHION COVER,1
85094,CANDY SPOT EGG WARMER RABBIT,1
85125,SMALL ROUND CUT GLASS CANDLESTICK,1
90059A,DIAMANTE HAIR GRIP PACK/2 CRYSTAL,1
90073,VINTAGE ENAMEL & CRYSTAL EARRINGS,1
90074,BLACK DIAMOND CLUSTER NECKLACE,1
90104,PURPLE FRANGIPANI HAIRCLIP,1
90129C,GREEN GLASS TASSLE BAG CHARM,1
90129D,AMBER GLASS TASSLE BAG CHARM,1
90129E,PURPLE GLASS TASSLE BAG CHARM,1
90177D,DROP DIAMANTE EARRINGS PURPLE,1
90185A,AMBER DIAMANTE EXPANDABLE RING,1
15044D,RED PAPER PARASOL,1
21617,4 LILY  BOTANICAL DINNER CANDLES,1
22693,GROW A FLYTRAP OR SUNFLOWER IN TIN,1
47574A,ENGLISH ROSE SCENTED HANGING FLOWER,1
72819,CUPID DESIGN SCENTED CANDLES,1
84665,SQUARE CHERRY BLOSSOM CABINET,1
22353,LUNCH BOX WITH CUTLERY FAIRY CAKES ,1
22498,WOODEN REGATTA BUNTING,1
84725,FREESTYLE CANVAS ART PICTURE,1
17038,PORCELAIN BUDAH INCENSE HOLDER,1
84388,WISE MAN STAR SHAPE EGG PAN,1
17084J,LOVE POTION MASALA INCENSE,1
22903,CALENDAR FAMILY FAVOURITES,1
22026,BANQUET BIRTHDAY  CARD  ,1
37340,MULTICOLOUR SPRING FLOWER MUG,1
AMAZONFEE,AMAZON FEE,1
16052,TEATIME PUSH DOWN RUBBER,1
16219,HOUSE SHAPE PENCIL SHARPENER,1
20763,DAISY SKETCHBOOK ,1
21316,SMALL CHUNKY GLASS ROMAN  BOWL,1
22293,HANGING CHICK GREEN DECORATION,1
22608,PENS ASSORTED FUNKY JEWELED ,1
22880,NUMBER TILE VINTAGE FONT 1,1
22883,NUMBER TILE VINTAGE FONT 4,1
22889,NUMBER TILE VINTAGE FONT No ,1
37500,TEA TIME TEAPOT IN GIFT BOX,1
79144C,PAINTED LIGHTBULB RAINBOW DESIGN,1
90005A,JADE GREEN ENAMEL HAIR COMB,1
90087,CRYSTAL SEA HORSE PHONE CHARM,1
90168,2 DAISIES HAIR COMB,1
90169,DAISY HAIR COMB,1
90187B,GREEN DROP EARRINGS W BEAD CLUSTER,1
90202C,GREEN ENAMEL FLOWER HAIR TIE,1
90210C,RED   ACRYLIC FACETED BANGLE,1
22528,GARDENERS KNEELING PAD,1
48189,DOORMAT FRIENDSHIP ,1
84989a,75 GREEN FAIRY CAKE CASES,1
15056n,EDWARDIAN PARASOL NATURAL,1
21410,COUNTRY COTTAGE  DOORSTOP GREEN,1
84559b,3D SHEET OF CAT STICKERS,1
85114c,RED ENCHANTED FOREST PLACEMAT,1
22513,DOORSTOP FOOTBALL DESIGN,1
84596b,SMALL DOLLY MIX DESIGN ORANGE BOWL,1
85119,WATERING CAN SINGLE HOOK PISTACHIO,1
85132a,CHARLIE + LOLA BISCUITS TINS,1
22875,NUMBER TILE COTTAGE GARDEN 7,1
47570b,TEA TIME TABLE CLOTH,1
84558a,3D DOG PICTURE PLAYING CARDS,1
84247E,PACK/12 XMAS FUN CARD,1
85059,FRENCH ENAMEL WATER BASIN,1
84497,BUTTONS AND STRIPES NOTEBOOK ,1
22512,DOORSTOP RACING CAR DESIGN,1
22611,VINTAGE UNION JACK SHOPPING BAG,1
22873,NUMBER TILE COTTAGE GARDEN 5,1
37467,PIG MUG IN TWO COLOUR DESIGNS,1
84251B,"GREETING CARD, STICKY GORDON",1
84927D,LA PALMIERA TILE HOOK,1
85213,MINI  ZINC GARDEN DECORATIONS ,1
90001C,ANTIQUE OPAL WHITE FLOWER EARRINGS,1
90023,FILIGREE DIAMANTE EARRINGS,1
90027A,GLASS BEAD HOOP EARRINGS BLACK,1
90170,DAISY HAIR BAND,1
90186B,CRYSTAL HOOP EARRING FLORAL LEAF,1
90211B,JET BLACK LAS VEGAS NECKLACE 45CM,1
90214K,"LETTER ""K"" BLING KEY RING",1
90214P,"LETTER ""P"" BLING KEY RING",1
90214Z,"LETTER ""Z"" BLING KEY RING",1
20663,QUEEN OF THE SKIES HOLIDAY PURSE ,1
21269,ANTIQUE CREAM CUTLERY SHELF ,1
21792,CLASSIC FRENCH STYLE BASKET GREEN ,1
22708,WRAP DOLLY GIRL,1
22048,BIRTHDAY BANQUET GIFT WRAP,1
22057,CERAMIC PLATE STRAWBERRY DESIGN,1
22932,BAKING MOULD TOFFEE CUP CHOCOLATE,1
22937,BAKING MOULD CHOCOLATE CUPCAKES,1
22710,WRAP I LOVE LONDON ,1
22936,BAKING MOULD ROSE WHITE CHOCOLATE,1
22935,BAKING MOULD ROSE MILK CHOCOLATE,1
47348A,FUSCHIA VOILE POINTY SHOE DEC,1
21686,MEDINA STAMPED METAL STOOL,1
21376,LARGE  TALL CAMPHOR WOOD TOADSTOOL ,1
20618,QUEEN OF THE SKIES PASSPORT COVER ,1
47420,ASSORTED COLOUR SUCTION CUP HOOK,1
22510,GINGHAM BABUSHKA DOORSTOP,1
48116,DOORMAT MULTICOLOUR STRIPE,1
35968,FOLK ART METAL HEART T-LIGHT HOLDER,1
22063,CERAMIC BOWL WITH STRAWBERRY DESIGN,1
20906,VINTAGE NOTEBOOK BEAUTY GIRL,1
21275,ZINC TOP  2 DOOR WOODEN SHELF ,1
78124,MAGAZINE RACK GEBRA ASSORTED ,1
79403,FROSTED WHITE BASE ,1
84251G,"GREETING CARD, OVERCROWDED POOL.",1
90059D,DIAMANTE HAIR GRIP PACK/2 PERIDOT,1
90201D,GREEN ENAMEL FLOWER RING,1
17013D,ORIGAMI ROSE INCENSE IN TUBE,1
17096,ASSORTED LAQUERED INCENSE HOLDERS,1
21442,GREEN BIRDHOUSE DECORATION,1
21717,EASTER TIN BUCKET,1
21750,LARGE SKULL WINDMILL,1
22538,MINI JIGSAW GO TO THE FAIR,1
22541,MINI JIGSAW LEAP FROG,1
71215,METAL BASE FOR CANDLES,1
22820,GIFT BAG BIRTHDAY,1
84706D,CHERRY BLOSSOM TABLE CLOCK ,1
22828,REGENCY MIRROR WITH SHUTTERS,1
22591,CARDHOLDER GINGHAM CHRISTMAS TREE,1
21661,VINTAGE GLASS TEA CADDY,1
84247L,FAWN AND MUSHROOM GREETING CARD,1
22937,BAKING MOULD CHOCOLATE CUP CAKES,1
84875B,GREEN SQUARE COMPACT MIRROR,1
84192,ASSORTED COLOUR METAL CAT ,1
21628,TRIANGULAR POUFFE VINTAGE ,1
22254,FELT TOADSTOOL LARGE,1
21615,4 LAVENDER BOTANICAL DINNER CANDLES,1
22236,CAKE STAND 3 TIER MAGIC GARDEN,1
22933,BAKING MOULD EASTER EGG MILK CHOC,1
22689,DOORMAT MERRY CHRISTMAS RED ,1
44235,ASS COL CIRCLE MOBILE ,1
40003,WHITE BAMBOO RIBS LAMPSHADE,1
84688,BEACH HUT DESIGN BLACKBOARD,1
79190B,RETRO PLASTIC POLKA TRAY,1
90036D,"FLOWER GLASS GARLAND NECKL.36""BLACK",1
21120,*Boombox Ipod Classic,1
21264,WHITE GOOSE FEATHER TREE 60CM ,1
22269,EGG CUP NATURAL CHICKEN,1
22526,WHEELBARROW FOR CHILDREN ,1
84012,MAGIC SHEEP WOOL GROWING FROM PAPER,1
90030B,RED KUKUI COCONUT SEED NECKLACE,1
90030C,BROWN KUKUI COCONUT SEED NECKLACE,1
90093,CLEAR CRYSTAL STAR PHONE CHARM,1
90128C,GREEN LEAVES AND BEADS PHONE CHARM,1
90128D,PURPLE LEAVES AND BEADS PHONE CHAR,1
90174,BUTTERFLY HAIR BAND,1
90188,DROP EARRINGS W FLOWER & LEAF,1
90214O,"LETTER ""O"" BLING KEY RING",1
DCGS0076,SUNJAR LED NIGHT NIGHT LIGHT,1
16015,MEDIUM CHINESE STYLE SCISSOR,1
16008,SMALL FOLDING SCISSOR(POINTED EDGE),1
37333,"RETRO ""TEA FOR ONE"" ",1
20778,GARDEN PATH NOTEBOOK ,1
20758,ABSTRACT CIRCLES POCKET BOOK,1
22319,HAIRCLIPS FORTIES FABRIC ASSORTED,1
22824,3 TIER SWEETHEART GARDEN SHELF,1
84818,DANISH ROSE PHOTO FRAME,1
21186,WHITE DOVE HONEYCOMB PAPER GARLAND,1
84802A,WHITE ANEMONE ARTIFICIAL FLOWER,1
22218,CAKE STAND LACE WHITE,1
84843,WHITE SOAP RACK WITH 2 BOTTLES,1
79066k,RETRO MOD TRAY,1
84536b,FAIRY CAKES NOTEBOOK A7 SIZE,1
22885,NUMBER TILE VINTAGE FONT 6 ,1
84356,POMPOM CURTAIN,1
47578A,ENGLISH ROSE SMALL SCENTED FLOWER,1
21562,HAWAIIAN GRASS SKIRT ,1
22856,ASSORTED EASTER DECORATIONS  BELLS,1
22934,BAKING MOULD EASTER EGG WHITE CHOC,1
16048,TEATIME ROUND PENCIL SHARPENER ,1
22263,FELT EGG COSY LADYBIRD ,1
46776F,WOVEN ROSE GARDEN CUSHION COVER ,1
84748,FOLK FELT HANGING MULTICOL GARLAND,1
90201C,RED ENAMEL FLOWER RING,1
22053,EMPIRE DESIGN ROSETTE,1
21131,GOLD STANDING GNOME,1
20654,FIRST CLASS LUGGAGE TAG ,1
17165D,ASS COL LARGE SAND FROG P'WEIGHT,1
22291,HANGING CHICK CREAM DECORATION,1
84820,DANISH ROSE TRINKET TRAYS,1
84821,DANISH ROSE DELUXE COASTER,1
84638,SMALL KITCHEN FLOWER POTS PLAQUE,1
22229,BUNNY WOODEN PAINTED WITH FLOWER ,1
22228,BUNNY WOODEN PAINTED WITH BIRD ,1
16169P,WRAP GREEN RUSSIAN FOLKART ,1
16054,POPART RECT PENCIL SHARPENER ASST,1
84595E,LARGE TORTILLA DESIGN RED BOWL,1
85084,HOLLY TOP CHRISTMAS STOCKING,1
81950V,FLOWER PURPLE CLOCK W/SUCKER,1
22055,MINI CAKE STAND  HANGING STRAWBERY,1
84799,SPRIG LAVENDER ARTIFICIAL FLOWER,1
22391,PAPERWEIGHT HOME SWEET HOME,1
21418,STARFISH SOAP DISH,1
21420,OYSTER TRINKET BOX,1
22286,"DECORATION , WOBBLY RABBIT , METAL ",1
22287,"DECORATION , WOBBLY CHICKEN, METAL ",1
35610C,WHITE CHRISTMAS FLOCK DROPLET ,1
46776D,WOVEN SUNSET CUSHION COVER ,1
85211,S/4 GROOVY CAT MAGNETS,1
90031,BILI NUT AND WOOD NECKLACE,1
90125B,AQUA BERTIE GLASS BEAD BAG CHARM,1
90125D,PURPLE BERTIE GLASS BEAD BAG CHARM,1
DCGS0003,BOXED GLASS ASHTRAY,1
22826,LOVE SEAT ANTIQUE WHITE METAL,1
22852,DOG BOWL VINTAGE CREAM,1
16033,MINI HIGHLIGHTER PENS,1
20831,GOLD PHOTO FRAME,1
21378,SMALL TALL CAMPHOR WOOD TOADSTOOL,1
22857,ASSORTED EASTER GIFT TAGS,1
22858,EASTER TIN KEEPSAKE,1
22861,EASTER TIN CHICKS IN GARDEN,1
22230,JIGSAW TREE WITH WATERING CAN,1
22232,JIGSAW TOADSTOOLS 3 PIECE,1
20664,TROPICAL HOLIDAY PURSE ,1
47593A,CAROUSEL PONIES BABY BIB,1
20670,VIP HOLIDAY PURSE,1
21946,PARTY TIME DESIGN FLANNEL,1
20666,ECONOMY HOLIDAY PURSE,1
82605,OLD DOC RUSSEL METAL SIGN,1
16216,LETTER SHAPE PENCIL SHARPENER,1
21248,DOOR HANGER  MUM + DADS ROOM,1
21736,GOLD SCROLL GLASS T-LIGHT HOLDER,1
90036E,"FLOWER GLASS GARLD NECKL36""AMETHYST",1
82011A,"BATHROOM SCALES, TROPICAL BEACH",1
22281,EASTER TREE YELLOW BIRDS,1
22887,NUMBER TILE VINTAGE FONT 8,1
90190B,GOLD/AMBER DROP EARRINGS W LEAF,1
35610B,BLACK CHRISTMAS FLOCK DROPLET ,1
84927E,FLOWERS TILE HOOK,1
84816,DANISH ROSE BEDSIDE CABINET,1
22289,HANGING METAL CHICKEN DECORATION,1
20704,MR ROBOT SOFT TOY,1
20818,GOLD TEDDY BEAR,1
90076,MONTANA DIAMOND CLUSTER EARRINGS,1
22954,HEN PARTY CORDON BARRIER TAPE,1
22047,EMPIRE GIFT WRAP,1
21331,MOROCCAN BEATEN METAL DISH LARGE,1
21145,ANTIQUE GLASS PLACE SETTING,1
84313C,ORANGE TV TRAY TABLE ,1
21473,SWEETHEART CREAM STEEL TABLE RECT,1
90210A,GREY ACRYLIC FACETED BANGLE,1
21109,LARGE CAKE TOWEL CHOCOLATE SPOTS,1
84823,DANISH ROSE FOLDING CHAIR,1
90057,DIAMANTE RING ASSORTED IN BOX.,1
90210D,PURPLE ACRYLIC FACETED BANGLE,1
20860,GOLD COSMETICS BAG WITH BUTTERFLY,1
84817,DANISH ROSE DECORATIVE PLATE,1
22932,BAKING MOULD TOFFEE CUP  CHOCOLATE,1
22937,BAKING MOULD CUPCAKE CHOCOLATE,1
22711,WRAP CIRCUS PARADE,1
22270,HAPPY EASTER HANGING DECORATION,1
85194L,HANGING SPRING FLOWER EGG LARGE,1
75178,ASSTD COL BUTTERFLY/CRYSTAL W/CHIME,1
47503A,ASS FLORAL PRINT MULTI SCREWDRIVER,1
22888,NUMBER TILE VINTAGE FONT 9 ,1
22886,NUMBER TILE VINTAGE FONT 7,1
22881,NUMBER TILE VINTAGE FONT 2,1
22879,NUMBER TILE VINTAGE FONT 0,1
21631,HIPPY CHIC DECORATIVE PARASOL,1
20705,MRS ROBOT SOFT TOY,1
85180A,RED HEARTS LIGHT CHAIN ,1
85159B,"WHITE TEA,COFFEE,SUGAR JARS",1
22963,JAM JAR WITH BLUE LID,1
90058B,CRYSTAL STUD EARRINGS ASSORTED COL ,1
84597B,RETRO BROWN BALL ASHTRAY ,1
84666,SQUARE CHERRY BLOSSOM CABINET,1
22303,COFFEE MUG APPLES DESIGN,1
21160,KEEP OUT GIRLS DOOR HANGER ,1
85114a,BLACK ENCHANTED FOREST PLACEMAT,1
21386,IVORY HANGING DECORATION  EGG,1
22257,FELT FARM ANIMAL SHEEP,1
22258,FELT FARM ANIMAL RABBIT,1
22259,FELT FARM ANIMAL HEN,1
85141,JARDIN ETCHED GLASS FRUITBOWL,1
90060B,FIRE POLISHED GLASS NECKL GOLD,1
90035A,"PEARL & SHELL 42""NECKL. GREEN",1
90133,TEAL/FUSCHIA COL BEAD NECKLACE,1
90179A,AMBER FINE BEAD NECKLACE W TASSEL,1
85146,JARDIN ETCHED GLASS SMALL BELL JAR,1
22033,BOTANICAL ROSE GREETING CARD,1
22032,BOTANICAL LILY GREETING CARD,1
84751B,BLACK MEDIUM GLASS CAKE STAND,1
84507B,STRIPES DESIGN MONKEY DOLL,1
84929,ASSTD FRUIT+FLOWERS FRIDGE MAGNETS,1
21707,FOLDING UMBRELLA BLACKBLUE POLKADOT,1
22868,NUMBER TILE COTTAGE GARDEN 0 ,1
22877,NUMBER TILE COTTAGE GARDEN 9,1
22878,NUMBER TILE COTTAGE GARDEN No,1
22874,NUMBER TILE COTTAGE GARDEN 6,1
22872,NUMBER TILE COTTAGE GARDEN 4,1
22869,NUMBER TILE COTTAGE GARDEN 1,1
22871,NUMBER TILE COTTAGE GARDEN 3 ,1
22302,COFFEE MUG PEARS  DESIGN,1
47594B,SCOTTIES DESIGN WASHBAG,1
21196,ROUND WHITE CONFETTI IN TUBE,1
22970,LONDON BUS COFFEE MUG,1
22040,BOTANICAL ROSE GIFT WRAP,1
22971,QUEENS GUARD COFFEE MUG,1
84877B,GREEN ROUND COMPACT MIRROR,1
84926F,PSYCHEDELIC TILE COASTER,1
21400,RED PUDDING SPOON,1
35911A,MULTICOLOUR RABBIT EGG WARMER,1
90012B,BLACK DROP CRYSTAL NECKLACE,1
21043,APRON MODERN VINTAGE COTTON,1
84750B,BLACK SMALL GLASS CAKE STAND,1
21425,SKULLS STORAGE BOX LARGE,1
21633,SUNFLOWER DECORATIVE PARASOL,1
22410,MONEY BOX HOUSEKEEPING DESIGN,1
22249,DECORATION WHITE CHICK MAGIC GARDEN,1
22407,MONEY BOX FIRST ADE DESIGN,1
22929,SCHOOL DESK AND CHAIR ,1
85088,CANDY SPOT HAND BAG,1
90201A,PURPLE ENAMEL FLOWER RING,1
90202A,PURPLE ENAMEL FLOWER HAIR TIE,1
90206A,GOLD DIAMANTE STAR BROOCH,1
22285,HANGING HEN ON NEST DECORATION,1
84600,NEW BAROQUE JEWELLERY BOX ,1
90165B,WHITE ROSEBUD  PEARL EARRINGS,1
20869,GOLD FABRIC MIRROR,1
20954,*USB Office Mirror Ball,1
21455,PAINTED YELLOW WOODEN DAISY,1
22206,"MUG , DOTCOMGIFTSHOP.COM ",1
90027B,GLASS BEAD HOOP EARRINGS MONTANA,1
21424,WOODLAND STORAGE BOX LARGE ,1
46000U,POLYESTER FILLER PAD 30CMx30CM,1
35400,WOODEN BOX ADVENT CALENDAR ,1
90072,RUBY DROP CHANDELIER EARRINGS,1
90214T,"LETTER ""T"" BLING KEY RING",1
21402,RED  EGG  SPOON,1
90011D,PURPLE CRYSTAL DROP EARRINGS,1
90141C,TURQ PENDANT TRIPLE SHELL NECKLACE,1
90142A,GREEN PENDANT SHELL NECKLACE,1
90177B,DROP DIAMANTE EARRINGS BLACK DIAMON,1
90154,LAZER CUT NECKLACE W PASTEL BEADS,1
90199D,5 STRAND GLASS NECKLACE AMBER,1
90178B,PURPLE CHUNKY GLASS+BEAD NECKLACE,1
21009,ETCHED GLASS STAR TREE DECORATION,1
21793,CLASSIC FRENCH STYLE BASKET BROWN,1
85023B,EAU DE NILE JEWELLED PHOTOFRAME,1
84804A,CREAM DELPHINIUM ARTIFICIAL FLOWER,1
22707,WRAP MONSTER FUN ,1
21503,TOYBOX  WRAP ,1
21747,SMALL SKULL WINDMILL,1
84249A,"GREETING CARD,SQUARE, DOUGHNUTS",1
22837,HOT WATER BOTTLE BABUSHKA LARGE,1
22953,BIRTHDAY BANNER TAPE,1
22148,EASTER CRAFT 4 CHICKS ,1
90011B,BLACK CRYSTAL DROP EARRINGS,1
90055,CRACKED GLAZE EARRINGS BROWN,1
90142D,MOP PENDANT SHELL NECKLACE,1
90176B,DIAMANTE NECKLACE BLACK ,1
gift_0001_40,Dotcomgiftshop Gift Voucher 40.00,1
90027D,GLASS BEAD HOOP EARRINGS AMETHYST,1
44228,CANNABIS LEAF BEAD CURTAIN,1
79191D,RETRO PLASTIC DAISY TRAY,1
85135B,Found,1
84199,GLOW IN DARK DOLPHINS,1
82613A,"METAL SIGN,CUPCAKE SINGLE HOOK",1
85135A,YELLOW DRAGONFLY HELICOPTER,1
22823,CHEST NATURAL WOOD 20 DRAWERS,1
DCGS0070,CAMOUFLAGE DOG COLLAR,1
85114b,IVORY ENCHANTED FOREST PLACEMAT,1
85160a,WHITE BIRD GARDEN DESIGN MUG,1
m,Manual,1
82613b,"METAL SIGN,CUPCAKE SINGLE HOOK",1
82613c,"METAL SIGN,CUPCAKE SINGLE HOOK",1
84795b,SUNSET CHECK HAMMOCK,1
85126,LARGE ROUND CUTGLASS CANDLESTICK,1
47518f,ICON PLACEMAT POP ART ELVIS,1
22734,FOUND,1
85049g,CHOCOLATE BOX RIBBONS ,1
16045,POPART WOODEN PENCILS ASST,1
84872A,TEATIME FUNKY FLOWER BACKPACK FOR 2,1
21394,RED POLKADOT BEAKER ,1
22046,TEA PARTY  WRAPPING PAPER ,1
21270,ANTIQUE CREAM CUTLERY CUPBOARD,1
85161,ACRYLIC GEOMETRIC LAMP,1
90013D,PURPLE VINTAGE EARRINGS,1
90024E,NEW BAROQUE B'FLY NECKLACE MONTANA,1
90024F,NEW BAROQUE B'FLY NECKLACE CRYSTAL,1
90103,PURPLE FRANGIPANI NECKLACE,1
90205C,LARGE CRYSTAL DIAMANTE HAIRSLIDE,1
22247,BUNNY DECORATION MAGIC GARDEN,1
gift_0001_50,Dotcomgiftshop Gift Voucher 50.00,1
84251C,"GREETING CARD, TWO SISTERS.",1
35443,RASTA IN BATH W SPLIFF ASHTRAY,1
84689,S/2 BEACH HUT TREASURE CHESTS,1
84675,FROG KING WATERING CAN,1
22501,Found,1
90125E,AMBER BERTIE GLASS BEAD BAG CHARM,1
85168B,BLACK BAROQUE CARRIAGE CLOCK,1
85186C,BUNNY EGG GARLAND,1
84926E,FLOWERS TILE COASTER,1
85144,JARDIN ETCHED GLASS CHEESE DISH,1
84218,BOX/12 CHICK & EGG IN BASKET,1
85194S,HANGING SPRING FLOWER EGG SMALL,1
22268,EASTER DECORATION SITTING BUNNY,1
90041,PEARL AND CHERRY QUARTZ BRACLET,1
90125C,TURQUOISE BERTIE GLASS BEAD CHARM,1
90163B,WHITE ROSEBUD & PEARL NECKLACE,1
84989A,75 GREEN FAIRY CAKE CASES,1
79071B,ENGLISH ROSE METAL WASTE BIN,1
16169M,WRAP DAISY CARPET ,1
22709,WRAP WEDDING DAY,1
gift_0001_30,Dotcomgiftshop Gift Voucher 30.00,1
gift_0001_20,Dotcomgiftshop Gift Voucher 20.00,1
20785,FUSCHIA RETRO BAR STOOL,1
85089,CANDY SPOT BUNNY,1
35909A,RABBIT EASTER DECORATION,1
35910A,MULTICOLOUR EASTER RABBIT ,1
21763,VINTAGE WOODEN BAR STOOL,1
90155,RESIN NECKLACE W PASTEL BEADS,1
47589,CONGRATULATIONS BUNTING,1
84661A,WHITE SQUARE TABLE CLOCK,1
90182C,BLACK 3 BEAD DROP EARRINGS,1
21278,VINTAGE KITCHEN PRINT PUDDINGS,1
47518F,ICON PLACEMAT POP ART ELVIS,1
16156L,"WRAP, CAROUSEL",1
90119,METALIC LEAVES BAG CHARMS,1
84741C,CITRUS GARLAND FELT FLOWERS ,1
22266,EASTER DECORATION HANGING BUNNY,1
22267,EASTER DECORATION EGG BUNNY ,1
21003,ROSE DU SUD CUSHION COVER,1
21757,LIGHTHOUSE PRINTED METAL SIGN,1
84617,NEW BAROQUE BLACK BOXES,1
21332,MOROCCAN BEATEN METAL MIRROR,1
90181A,AMBER GLASS/SHELL/PEARL NECKLACE,1
90214W,"LETTER ""W"" BLING KEY RING",1
90059F,DIAMANTE HAIR GRIP PACK/2 LT ROSE,1
21280,VINTAGE KITCHEN PRINT VEGETABLES,1
22837,Found,1
20748,Found,1
21667,GLASS CAKE COVER AND PLATE,1
35915C,PEACH KNITTED HEN ,1
47556B,TEA TIME TEA TOWELS ,1
35265,COLOURFUL FLOWER FRUIT BOWL,1
16162L,THE KING GIFT BAG,1
90011E,AMBER CRYSTAL DROP EARRINGS,1
90079,VINTAGE ENAMEL & CRYSTAL NECKLACE,1
90141D,ROSE PENDANT TRIPLE SHELL NECKLACE,1
85160B,BLACK BIRD GARDEN DESIGN MUG,1
23231,WRAP DOILEY DESIGN,1
23230,WRAP ALPHABET DESIGN,1
85189,HANGING BUTTERFLY  EGG,1
90130D,RED STONE/CRYSTAL EARRINGS,1
21117,BLOND DOLL DOORSTOP,1
21459,YELLOW EASTER EGG HUNT START POST,1
21460,GREEN EASTER EGG HUNT START POST,1
37468,HARDMAN MUG 3 ASSORTED,1
22896,PEG BAG APPLE DESIGN,1
22199,FRYING PAN RED POLKADOT ,1
20725,LUNCH BAG RED SPOTTY,1
17174,ASSTD RASTA KEY-CHAINS,1
23233,WRAP POPPIES  DESIGN,1
35921,EASTER BUNNY HANGING GARLAND,1
85200,BUNNY EGG BOX,1
84231,EASTER BUNNY WITH BASKET ON BACK,1
35922,EASTER BUNNY WREATH,1
23232,WRAP VINTAGE PETALS  DESIGN,1
84806B,WHITE CANDYSTUFT ARTIFICIAL FLOWER,1
21458,2 PICTURE BOOK EGGS EASTER BUNNY,1
85198,ASSORTED FARMYARD ANIMALS IN BUCKET,1
23166,MEDIUM CERAMIC TOP STORAGE JAR,1
84033,FLAG OF ST GEORGE ,1
84226,HEN HOUSE W FAMILY IN BARN & NEST,1
21926,RED/CREAM STRIPE CUSHION COVER ,1
35920,FOUR RABBIT EASTER DECORATIONS,1
84592,CROCHET ROSE PURSE WITH SUEDE BACK,1
79192A,RETRO PLASTIC 70'S TRAY,1
20756,GREEN FERN POCKET BOOK,1
21320,GLASS CHALICE GREEN  LARGE ,1
90027C,GLASS BEAD HOOP EARRINGS GREEN,1
90202B,WHITE ENAMEL FLOWER HAIR TIE,1
22125,UNION JACK HOT WATER BOTTLE ,1
40046A,RED DAISY PAPER LAMPSHADE,1
85188A,GREEN METAL SWINGING BUNNY,1
71101E,STANDING FAIRY POLE SUPPORT ,1
21457,2 PICTURE BOOK EGGS EASTER DUCKS,1
21456,2 PICTURE BOOK EGGS EASTER CHICKS,1
84632,DECORATIVE HANGING SHELVING UNIT,1
22764,"RUSTIC WOODEN CABINET, GLASS DOORS",1
22146,EASTER CRAFT IVY WREATH WITH CHICK,1
85047,WHITE BEADED GARLAND STRING 20LIGHT,1
21476,STEEL SWEETHEART ROUND TABLE CREAM,1
37351,ORANGE FLOWER MUG ,1
85160A,WHITE BIRD GARDEN DESIGN MUG,1
84997a,GREEN 3 PIECE POLKADOT CUTLERY SET,1
21344,MOROCCAN BEATEN METAL DISH,1
84279B,CHERRY BLOSSOM DECORATIVE FLASK,1
84452,METAL RABBIT LADDER EASTER ,1
90016B,GOLD/M.O.P PENDANT ORBIT NECKLACE,1
20898,VINTAGE NOTEBOOK TRAVELOGUE,1
37413,ICON MUG REVOLUTIONARY,1
79063D,"RETRO PILL BOX , REVOLUTIONARY",1
85049B,Amazon,1
90183C,BLACK DROP EARRINGS W LONG BEADS,1
DCGS0069,OOH LA LA DOGS COLLAR,1
85024B,EAU DE NILE JEWELLED PHOTOFRAME,1
17028J,INCENSE BAZAAR PEACH,1
17084A,TRANQUILITY MASALA INCENSE,1
84795C,OCEAN STRIPE HAMMOCK ,1
62074B,ELEPHANT CLIP W SUCTION CUP,1
84801B,WHITE HYDRANGEA ART FLOWER,1
84805A,CREAM CLIMBING HYDRANGA ART FLOWER,1
84993a,75 GREEN PETIT FOUR CASES,1
84723,CHERRY BLOSSOM CANVAS ART PICTURE,1
22038,BOTANICAL LAVENDER GIFT WRAP ,1
79063C,"RETRO PILL BOX KEY CHAIN,THE KING",1
79062D,"RETRO TIN ASHTRAY,REVOLUTIONARY",1
15058C,ICE CREAM DESIGN GARDEN PARASOL,1
22990,COTTON APRON PANTRY DESIGN,1
85092,CANDY SPOT TEA COSY,1
DCGSSBOY,BOYS PARTY BAG,1
DCGSSGIRL,GIRLS PARTY BAG,1
21228,"POCKET MIRROR ""GLAMOROUS""",1
84536a,ENGLISH ROSE NOTEBOOK A7 SIZE,1
72812,LARGE ZINC GLASS CANDLEHOLDER,1
75172,PAINTED SEA SHELL METAL WINDCHIME,1
45013,FOLDING SHOE TIDY,1
21636,MADRAS NOTEBOOK MEDIUM,1
71510,SQUARE METAL CANDLEHOLDER BASE,1
44265,M/COLOUR POM-POM CURTAIN,1
79323B,BLACK CHERRY LIGHTS,1
90064B,BLACK VINTAGE  CRYSTAL EARRINGS,1
90064A,WHITE VINTAGE CRYSTAL EARRINGS,1
90063A,WHITE VINT ART DECO CRYSTAL NECKLAC,1
90063B,BLACK VINT ART DEC CRYSTAL NECKLACE,1
90029,NEW BAROQUE SMALL NECKLACE BLACK,1
44089C,LILAC GAUZE BUTTERFLY LAMPSHADE,1
90024B,NEW BAROQUE B'FLY NECKLACE RED,1
84798B,PURPLE FOXGLOVE ARTIIFCIAL FLOWER,1
21681,GIANT MEDINA STAMPED METAL BOWL ,1
90180B,PURPLE AMETHYST NECKLACE W TASSEL,1
79406,FROSTED WHITE BASE ,1
22980,PANTRY SCRUBBING BRUSH,1
